,Unnamed: 0,country,subCategory,industry,title,multi_location,type,orgFunction,experience,locale,multi_location_array,jobSeqNo,postedDate,searchresults_display,descriptionTeaser,dateCreated,state,targetLevel,jd_display,reqId,badge,jobId,isMultiLocation,jobVisibility,mostpopular,location,category,locationLatlong
801,1,United States,Hardware Development Engineering,,Physical Design Engineer,"['Raleigh, North Carolina, United States']",,,Experienced professionals,en_us,"[{'location': 'Raleigh, North Carolina, United States'}]",756629,2019-12-05T22:31:00,,"Microsoft&rsquo;s hardware teams incubate advanced technologies and build deep partnerships with internal research, product planning, and marketing teams. Microsoft ships tens of millions of hardware",2019-12-05T22:33:35.464000,North Carolina,62.0,,,,756629,True,['external'],0.0,"Raleigh, North Carolina, United States",Hardware Engineering,
802,2,United States,Software Engineering,,Senior Software Engineer,"['Redmond, Washington, United States']",,,Experienced professionals,en_us,"[{'location': 'Redmond, Washington, United States'}]",663176,2019-12-06T19:57:00,,Are you excited about working with talented engineers and scientists on a highly scalable and reliable online service in the modern Cloud? Are you an engineer willing to learn and master your skills,2019-12-06T22:02:14.387000,Washington,64.0,,,,663176,True,['external'],0.0,"Redmond, Washington, United States",Engineering,
803,3,United States,Software Engineering,,Principal Software Engineer,"['Redmond, Washington, United States']",,,Experienced professionals,en_us,"[{'location': 'Redmond, Washington, United States'}]",752094,2019-11-27T16:13:00,,"OneDrive is Microsoft&rsquo;s solution for cloud file storage - the one place for all your important documents, files and folders, photos and videos and more, across work and life, and on all your",2019-11-27T16:15:32.879000,Washington,65.0,,,,752094,True,['external'],0.0,"Redmond, Washington, United States",Engineering,
804,4,United States,Software Engineering,,Senior Software Engineer,"['Redmond, Washington, United States']",,,Experienced professionals,en_us,"[{'location': 'Redmond, Washington, United States'}]",758933,2019-12-10T21:19:00,,"Are you interested in working for one of the most exciting products in Microsoft, passionate about exceeding customer expectations and advancing Microsoft&rsquo;s cloud first strategy? Are you",2019-12-10T21:34:36.506000,Washington,63.0,,,,758933,True,['external'],0.0,"Redmond, Washington, United States",Engineering,
806,6,United States,Software Engineering,,Senior Software Engineer,"['Redmond, Washington, United States']",,,Experienced professionals,en_us,"[{'location': 'Redmond, Washington, United States'}]",704702,2019-09-16T19:18:00,,Every once in a while a job comes along with an opportunity to be at forefront of a brand new business. If you have been waiting for that kind of opportunity this may be the job for you. We are a,2019-09-16T19:33:33.062000,Washington,63.0,,,,704702,True,['external'],0.0,"Redmond, Washington, United States",Engineering,
808,8,United States,Software Engineering,,Software Engineer,"['Redmond, Washington, United States']",,,Experienced professionals,en_us,"[{'location': 'Redmond, Washington, United States'}]",756677,2019-12-07T02:08:00,,"Do you want an opportunity to make an impact on enterprise customers around the world? Be part of our mission for building enterprise management and security solutions.You would be creating products,",2019-12-07T02:12:33.581000,Washington,60.0,,,,756677,True,['external'],0.0,"Redmond, Washington, United States",Engineering,
809,9,United States,Software Engineering,,Software Engineer II,"['Redmond, Washington, United States']",,,Experienced professionals,en_us,"[{'location': 'Redmond, Washington, United States'}]",756291,2019-12-06T17:06:00,,Do you want to work on ever expanding scenarios of multi-sensor computer vision and AR/MR/VR/ML experiences on a broad range of devices and form factors? We are looking for a solid developer who can,2019-12-06T17:12:34.442000,Washington,62.0,,,,756291,True,['external'],0.0,"Redmond, Washington, United States",Engineering,
812,12,United States,Sourcing Engineering,,Sr. Sourcing Engineer,"['Redmond, Washington, United States']",,,Experienced professionals,en_us,"[{'location': 'Redmond, Washington, United States'}]",673332,2019-07-24T14:01:00,,"If you have a passion to deliver new technology to customers and have a strong background in Contract Manufacturing, manufacturing management or Sourcing, then this position is for you. This position",2019-07-25T22:27:33.291000,Washington,63.0,,,,673332,True,['external'],0.0,"Redmond, Washington, United States",Hardware Manufacturing Engineering,
818,18,United States,Service Engineering,,Sr. Azure Cloud Engineer Lead,"['Redmond, Washington, United States']",,,Experienced professionals,en_us,"[{'location': 'Redmond, Washington, United States'}]",742420,2019-11-12T21:21:00,,Would you like to join and lead one of the fastest-growing team within Microsoft Azure Engineering? Are you customer-obsessed constantly looking for enhancing customer experience? Are you passionate,2019-11-12T21:26:05.487000,Washington,64.0,,,,742420,True,['external'],0.0,"Redmond, Washington, United States",Engineering,
819,19,United States,Support Engineering,,"Support Engineer - Azure Logic Apps, Biztalk Server, MSMQ","['Charlotte, North Carolina, United States']",,,Experienced professionals,en_us,"[{'location': 'Charlotte, North Carolina, United States'}]",757014,2019-12-09T19:28:00,,"Support Engineer - Azure Logic Apps, Biztalk Server, MSMQ Interested in Azure Logic Apps and Orchestration? Are you passionate about customer experience? Then come join the CSS Integration team at",2019-12-09T19:35:42.240000,North Carolina,61.0,,,,757014,True,['external'],0.0,"Charlotte, North Carolina, United States",Services,
835,35,United States,Software Engineering,,Principal Software Engineer,"['Redmond, Washington, United States']",,,Experienced professionals,en_us,"[{'location': 'Redmond, Washington, United States'}]",724870,2019-10-16T18:36:00,,"The Hyper-V team is looking for talented software engineers to develop Microsoft's versatile, performance critical, and secure virtualization platform.  We are looking for enthusiastic candidates who",2019-10-16T18:39:36.533000,Washington,65.0,,,,724870,True,['external'],0.0,"Redmond, Washington, United States",Engineering,
836,36,United States,Software Engineering,,Senior Software Engineer,"['Redmond, Washington, United States']",,,Experienced professionals,en_us,"[{'location': 'Redmond, Washington, United States'}]",749519,2019-11-25T17:56:00,,Be part of the datacenter management transformation! Our charter is to enable Azure to run on commodity hardware while providing the SLAs expected by our customers. At the heart of Azure sits the,2019-11-25T18:00:06.464000,Washington,63.0,,,,749519,True,['external'],0.0,"Redmond, Washington, United States",Engineering,
837,37,United States,Software Engineering,,Senior Software Engineer,"['Redmond, Washington, United States']",,,Experienced professionals,en_us,"[{'location': 'Redmond, Washington, United States'}]",746959,2019-11-21T03:35:00,,"Do you want to work in an exciting team at the heart of the Microsoft public elastic Compute and Storage Cloud, as well as Microsoft&rsquo;s private Bing Cloud? The three key services a modern cloud",2019-11-21T03:37:40.661000,Washington,63.0,,,,746959,True,['external'],0.0,"Redmond, Washington, United States",Engineering,
838,38,United States,New Product Introduction Engineering,,DFX Engineer II,"['Redmond, Washington, United States']",,,Experienced professionals,en_us,"[{'location': 'Redmond, Washington, United States'}]",721987,2019-11-25T22:49:00,,Do you want to be part of the team that brings world class hardware from concept to market? The Design for Excellence (DfX) team within Microsoft's NPI group enables the delivery of world class,2019-11-25T22:51:37.177000,Washington,62.0,,,,721987,True,['external'],0.0,"Redmond, Washington, United States",Hardware Manufacturing Engineering,
841,41,United States,Software Engineering,,Software Engineer II,"['Bellevue, Washington, United States']",,,Experienced professionals,en_us,"[{'location': 'Bellevue, Washington, United States'}]",483829,2018-10-15T19:12:00,,"Microsoft Teams is the new chat-based application in Office 365. It's a hub for teamwork, giving teams instant access to everything they need right in Office 365. Microsoft Teams is the canvas that",2018-10-15T19:14:31.837000,Washington,60.0,,,,483829,True,['external'],1.9285714030265808,"Bellevue, Washington, United States",Engineering,
851,1,United States,Support Engineering,,SQL Support Escalation Engineer,"['Charlotte, North Carolina, United States', 'Las Colinas, Texas, United States', 'Fargo, North Dakota, United States']",,,Experienced professionals,en_us,"[{'location': 'Charlotte, North Carolina, United States'}, {'location': 'Las Colinas, Texas, United States'}, {'location': 'Fargo, North Dakota, United States'}]",726546,2019-10-29T21:54:00,,SQL Support Escalation EngineerWe are the CSS Data &amp; Enterprise Team and our work focuses on improving the overall customer experience with Microsoft Server technologies and cloud services. Our,2019-10-29T21:56:45.723000,North Carolina,62.0,,,,726546,True,['external'],0.0,"Charlotte, North Carolina, United States",Services,
852,2,United States,Software Engineering,,Senior Software Engineer,"['Redmond, Washington, United States']",,,Experienced professionals,en_us,"[{'location': 'Redmond, Washington, United States'}]",617675,2019-06-25T17:48:00,,"Hundreds and hundreds of millions of devices run Windows, and they all have to be kept up to date. Whether that device is a Desktop or a Server down through Hololens, IoT or other devices. With",2019-06-25T20:27:22.983000,Washington,63.0,,,,617675,True,['external'],0.0,"Redmond, Washington, United States",Engineering,
856,6,United States,Software Engineering,,Sr. Software Engineer,"['Redmond, Washington, United States']",,,Experienced professionals,en_us,"[{'location': 'Redmond, Washington, United States'}]",720456,2019-10-09T12:33:00,,"Microsoft Azure is undergoing explosive growth as customers around the world realize the benefits of moving their services and applications on to the cloud. For Azure, providing a secure cloud",2019-10-09T12:35:33.358000,Washington,63.0,,,,720456,True,['external'],0.0,"Redmond, Washington, United States",Engineering,
857,7,United States,Hardware Development Engineering,,Software Engineer,"['Redmond, Washington, United States']",,,Experienced professionals,en_us,"[{'location': 'Redmond, Washington, United States'}]",736914,2019-11-01T22:21:00,,Microsoft&rsquo;s Capacity Planning and Provisioning team is an exciting and fast evolving engineering group enabling the growth of all of Microsoft's Cloud businesses by optimizing the delivery of,2019-11-01T22:24:34.028000,Washington,61.0,,,,736914,True,['external'],0.0,"Redmond, Washington, United States",Hardware Engineering,
866,16,United States,Software Engineering,,Principal Software Engineer,"['Bellevue, Washington, United States']",,,Experienced professionals,en_us,"[{'location': 'Bellevue, Washington, United States'}]",653416,2019-06-28T18:00:00,,Our team is Intentional Exploration and we are working to improve the Intentional Platform. The Intentional Platform is an exciting new technology acquired by Microsoft in 2017. It is the basis for a,2019-06-28T21:08:31.894000,Washington,65.0,,,,653416,True,['external'],0.0,"Bellevue, Washington, United States",Engineering,
873,23,United States,Mechanical Engineering,,Sr. Mechanical Engineer - HoloLens,"['Redmond, Washington, United States']",,,Experienced professionals,en_us,"[{'location': 'Redmond, Washington, United States'}]",695447,2019-08-27T21:55:00,,"Are you passionate about Augmented/Virtual Reality and building cool devices and technologies? Cognition focuses on lighting up Microsoft experiences with world class hardware. In Cognition, people",2019-08-27T21:58:07.539000,Washington,63.0,,,,695447,True,['external'],0.0,"Redmond, Washington, United States",Hardware Engineering,
874,24,United States,Hardware Design Verification Engineering,,Electrical Engineer II - HoloLens,"['Mountain View, California, United States']",,,Experienced professionals,en_us,"[{'location': 'Mountain View, California, United States'}]",695895,2019-08-27T19:35:00,,Are you passionate about building and prototyping cool devices and technologies? The Windows Devices Group New Technology Integration Team focuses on lighting up Microsoft experiences with world class,2019-08-27T19:59:35.744000,California,62.0,,,,695895,True,['external'],0.0,"Mountain View, California, United States",Hardware Engineering,
881,31,United States,Software Engineering,,Senior Engineering Manager - CTJ,"['Reston, Virginia, United States']",,,Experienced professionals,en_us,"[{'location': 'Reston, Virginia, United States'}]",721503,2019-10-10T16:17:00,,"Empower every person and organization on the planet to achieve more. That&rsquo;s what inspires us, drives our work and pushes us to challenge the status quo every day. The Identity division in Cloud",2019-10-10T16:19:34.230000,Virginia,64.0,,,,721503,True,['external'],0.0,"Reston, Virginia, United States",Engineering,
882,32,United States,Software Development,,Backend Software Engineer,"['New York, New York, United States']",,,Experienced professionals,en_us,"[{'location': 'New York, New York, United States'}]",727586,2019-10-22T03:41:00,,The Reinforcement Learning (RL) engineering team in Microsoft Research NYC is hiring. We&rsquo;re creating a leading edge Reinforcement Learning system to solve real-world interactive problems (check,2019-10-22T03:56:35.102000,New York,62.0,,,,727586,True,['external'],0.0,"New York, New York, United States",Engineering,
884,34,United States,Software Engineering,,Principal Software Engineer,"['Redmond, Washington, United States']",,,Experienced professionals,en_us,"[{'location': 'Redmond, Washington, United States'}]",579142,2019-07-30T06:06:00,,Come join the team that is owning the core Azure Network control plane service and Network APIs. This is a unique opportunity to work on a core Azure service fundamental to VM deployments and network,2019-07-31T05:21:33.504000,Washington,65.0,,,,579142,True,['external'],0.0,"Redmond, Washington, United States",Engineering,
885,35,United States,Software Engineering,,Software Engineer 2,"['Redmond, Washington, United States']",,,Experienced professionals,en_us,"[{'location': 'Redmond, Washington, United States'}]",742172,2019-11-13T21:06:00,,Are you passionate about designing and building the next generation time management platform used by hundreds of millions of users every day? Do you want to work on the cutting-edge scalable backend,2019-11-13T21:08:32.202000,Washington,62.0,,,,742172,True,['external'],0.0,"Redmond, Washington, United States",Engineering,
886,36,United States,Hardware Design Verification Engineering,,Design Verification Engineer 2,"['Redmond, Washington, United States']",,,Experienced professionals,en_us,"[{'location': 'Redmond, Washington, United States'}]",553249,2019-06-26T19:30:00,,Microsoft is a leader in the design of world class entertainment devices. We are looking for a strong design verification engineer to work in the silicon team on exciting new products such as Xbox and,2019-07-31T17:26:37.169000,Washington,61.0,,,,553249,True,['external'],0.0,"Redmond, Washington, United States",Hardware Engineering,
887,37,United States,Hardware Design Verification Engineering,,Senior Design Verification Engineer,"['Sunnyvale, California, United States', 'Redmond, Washington, United States', 'Fort Collins, Colorado, United States']",,,Experienced professionals,en_us,"[{'location': 'Sunnyvale, California, United States'}, {'location': 'Redmond, Washington, United States'}, {'location': 'Fort Collins, Colorado, United States'}]",580481,2019-02-08T01:59:00,,Microsoft is a leader in the design of world class entertainment devices. We are looking for a strong design verification engineer to work in the silicon team on exciting new products such as Xbox and,2019-02-08T02:03:31.166000,California,64.0,,,,580481,True,['external'],0.0,"Sunnyvale, California, United States",Hardware Engineering,
889,39,United States,Software Engineering,,Sr. Software Engineer,"['Redmond, Washington, United States']",,,Experienced professionals,en_us,"[{'location': 'Redmond, Washington, United States'}]",742876,2019-11-14T20:13:00,,"Join the Azure Key Vault team, a quickly growing service that&rsquo;s protecting critical Microsoft cloud data and helping attract major industry customers to Microsoft Azure! You&rsquo;ll work on a",2019-11-14T20:18:33.399000,Washington,63.0,,,,742876,True,['external'],0.0,"Redmond, Washington, United States",Engineering,
890,40,United States,Hardware Design Verification Engineering,,Design or Verification Engineering Manager,"['Raleigh, North Carolina, United States']",,,Experienced professionals,en_us,"[{'location': 'Raleigh, North Carolina, United States'}]",627946,2019-05-17T23:45:00,,"Microsoft&rsquo;s hardware teams incubate advanced technologies and build deep partnerships with internal research, product planning, and marketing teams. Microsoft ships tens of millions of hardware",2019-05-17T23:50:34.696000,North Carolina,64.0,,,,627946,True,['external'],0.0,"Raleigh, North Carolina, United States",Hardware Engineering,
891,41,United States,Hardware Development Engineering,,Principal Physical Design Engineer,"['Raleigh, North Carolina, United States']",,,Experienced professionals,en_us,"[{'location': 'Raleigh, North Carolina, United States'}]",611912,2019-04-13T00:04:00,,"Microsoft&rsquo;s hardware teams incubate advanced technologies and build deep partnerships with internal research, product planning, and marketing teams. Microsoft ships tens of millions of hardware",2019-04-13T00:07:35.611000,North Carolina,65.0,,,,611912,True,['external'],0.0,"Raleigh, North Carolina, United States",Hardware Engineering,
892,42,United States,Software Engineering,,Principal Software Engineering Manager,"['Redmond, Washington, United States']",,,Experienced professionals,en_us,"[{'location': 'Redmond, Washington, United States'}]",742581,2019-11-14T23:17:00,,Do you want to contribute to Azure Growth and Adoption in the market? Do you want to impact the business and help drive Azure to be the market leader in the cloud? Do you like to work in a fast-paced,2019-11-14T23:30:42.832000,Washington,65.0,,,,742581,True,['external'],0.0,"Redmond, Washington, United States",Engineering,
895,45,United States,Software Engineering,,Software Engineer,"['Redmond, Washington, United States', 'Redmond, Washington, United States']",,,Experienced professionals,en_us,"[{'location': 'Redmond, Washington, United States'}, {'location': 'Redmond, Washington, United States'}]",741329,2019-11-15T16:38:00,,"Learning empowers people. Learning can change lives. Here is an exciting opportunity for you to influence online learning. We reach millions of learners where they are, anytime, anywhere, and serve up",2019-11-15T16:40:33.292000,Washington,59.0,,,,741329,True,['external'],0.0,"Redmond, Washington, United States",Engineering,
898,48,United States,Service Engineering,,Service Engineer II,"['Redmond, Washington, United States']",,,Experienced professionals,en_us,"[{'location': 'Redmond, Washington, United States'}]",738754,2019-11-06T18:14:00,,The world of business is undergoing a significant change with the next Digital Revolution; the move to the cloud. M365 is at the forefront of this revolution with an ever-expanding array of services,2019-11-06T18:17:33.467000,Washington,62.0,,,,738754,True,['external'],0.0,"Redmond, Washington, United States",Engineering,
902,2,United States,Software Engineering,,Principal Software Engineering Manager,"['Redmond, Washington, United States']",,,Experienced professionals,en_us,"[{'location': 'Redmond, Washington, United States'}]",756412,2020-03-11T18:12:00,,"The Cloud Hardware &amp; Infrastructure Engineering team is responsible for definition, design and development of Server and Rack Infrastructure engineering for Microsoft's online services (Azure /",2020-03-11T19:00:39.730000,Washington,66.0,,,,756412,True,['external'],0.0,"Redmond, Washington, United States",Engineering,
904,4,United States,Software Engineering,,Senior Software Engineer,"['Redmond, Washington, United States']",,,Experienced professionals,en_us,"[{'location': 'Redmond, Washington, United States'}]",805356,2020-03-09T20:16:00,,OverviewThe Microsoft 365 Enterprise Health team is looking for a high-energy engineer with a passion for building great end-to-end customer experiences backed by data analysis and intelligence. If,2020-03-11T19:46:33.495000,Washington,63.0,,,,805356,True,['external'],0.0,"Redmond, Washington, United States",Engineering,
905,5,United States,Software Engineering,,Principal Software Engineer,"['Redmond, Washington, United States']",,,Experienced professionals,en_us,"[{'location': 'Redmond, Washington, United States'}]",765929,2019-12-26T21:02:00,,"BigData is just starting to change the world, and the BigData team at C&amp;E has one of the biggest cluster deployments in the world, running over hundreds of thousands of machines in multiple",2019-12-26T21:05:32.742000,Washington,65.0,,,,765929,True,['external'],0.0,"Redmond, Washington, United States",Engineering,
907,7,United States,Software Engineering,,Software Engineer,"['Redmond, Washington, United States']",,,Experienced professionals,en_us,"[{'location': 'Redmond, Washington, United States'}]",706597,2019-11-08T02:22:00,,Are you looking for an opportunity to defend the productivity of millions worldwide against malicious individuals and organizations? Continually curious about innovative techniques and technologies in,2019-11-08T17:15:49.656000,Washington,60.0,,,,706597,True,['external'],0.0,"Redmond, Washington, United States",Engineering,
909,9,United States,Service Engineering,,Datacenter Engineering Technical Due Diligence Global Manager,"['Redmond, Washington, United States']",,,Experienced professionals,en_us,"[{'location': 'Redmond, Washington, United States'}]",803580,2020-03-11T20:58:00,,"Microsoft Cloud Operations and Innovation (CO&amp;I) is the team behind the cloud. CO&amp;I is responsible for delivering Microsoft web portals, Live and Online Services around the world including",2020-03-11T21:02:00.331000,Washington,65.0,,,,803580,True,['external'],0.0,"Redmond, Washington, United States",Engineering,
918,18,United States,Software Engineering,,Principal Software Engineer,"['Bellevue, Washington, United States']",,,Experienced professionals,en_us,"[{'location': 'Bellevue, Washington, United States'}]",653416,2019-06-28T18:00:00,,Our team is Intentional Exploration and we are working to improve the Intentional Platform. The Intentional Platform is an exciting new technology acquired by Microsoft in 2017. It is the basis for a,2019-06-28T21:08:31.894000,Washington,65.0,,,,653416,True,['external'],0.0,"Bellevue, Washington, United States",Engineering,
925,25,United States,Software Engineering,,Software Engineer II,"['Redmond, Washington, United States']",,,Experienced professionals,en_us,"[{'location': 'Redmond, Washington, United States'}]",717112,2019-10-04T21:02:00,,"The Commerce Financial Services team empowers commerce scenarios across all dimensions of Microsoft including Azure, Office and Gaming for both Consumer and Commercial customers. We are looking for a",2019-10-04T21:05:39.978000,Washington,62.0,,,,717112,True,['external'],0.0,"Redmond, Washington, United States",Engineering,
928,28,United States,Software Engineering,,Principal Software Engineer,"['Redmond, Washington, United States']",,,Experienced professionals,en_us,"[{'location': 'Redmond, Washington, United States'}]",705221,2019-10-03T20:05:00,,"Are you a back-end developer who is interested in data analytics and, more specifically, how data analytics is done? Are you ready to disassemble a modern analytic engine, figure out what every little",2019-10-03T20:39:31.658000,Washington,65.0,,,,705221,True,['external'],0.0,"Redmond, Washington, United States",Engineering,
929,29,United States,Software Engineering,,Software Engineer 2,"['Bellevue, Washington, United States']",,,Experienced professionals,en_us,"[{'location': 'Bellevue, Washington, United States'}]",714971,2019-10-03T04:54:00,,The Bing Local &amp; Maps team is looking for an experienced software engineers to help us deliver the best possible local search experience in Bing for the United States and other global markets.This,2019-10-03T04:56:33.411000,Washington,62.0,,,,714971,True,['external'],0.0,"Bellevue, Washington, United States",Engineering,
935,35,United States,Software Engineering,,Software Engineer,"['Redmond, Washington, United States']",,,Experienced professionals,en_us,"[{'location': 'Redmond, Washington, United States'}]",726459,2019-10-16T20:24:00,,"Are you passionate about building always available, scalable, highly responsive services? Do you want to work on building experiences that boost productivity for thousands of your coworkers?",2019-10-16T20:27:32.959000,Washington,60.0,,,,726459,True,['external'],0.0,"Redmond, Washington, United States",Engineering,
