,Unnamed: 0,country,subCategory,industry,title,multi_location,type,orgFunction,experience,locale,multi_location_array,jobSeqNo,postedDate,searchresults_display,descriptionTeaser,dateCreated,state,targetLevel,jd_display,reqId,badge,jobId,isMultiLocation,jobVisibility,mostpopular,location,category,locationLatlong
1706,6,United States,Software Engineering,,Software Engineer,"['Redmond, Washington, United States']",,,Experienced professionals,en_us,"[{'location': 'Redmond, Washington, United States'}]",715442,2020-01-29T20:52:00,,"The Identity engineering team builds and manages Microsoft&rsquo;s online identity providers for all of Microsoft&rsquo;s online services and platforms like Azure, Office, Xbox, and HoloLens. We",2020-01-29T20:54:33.145000,Washington,60.0,,,,715442,True,['external'],0.0,"Redmond, Washington, United States",Engineering,
1707,7,United States,Software Engineering,,Senior Software Engineer,"['Redmond, Washington, United States']",,,Experienced professionals,en_us,"[{'location': 'Redmond, Washington, United States'}]",725700,2019-10-21T20:27:00,,Do you want to contribute to Azure Growth and Adoption in the Market?  Do you want to ensure that Azure continues to be the market leader and preferred customer choice for Cloud? Do you agree that,2019-10-21T20:30:37.153000,Washington,63.0,,,,725700,True,['external'],0.0,"Redmond, Washington, United States",Engineering,
1712,12,United States,Software Engineering,,Software Engineer 2,"['Bellevue, Washington, United States']",,,Experienced professionals,en_us,"[{'location': 'Bellevue, Washington, United States'}]",783401,2020-01-28T23:59:00,,Are you a software engineer looking for opportunities to use machine learning to deliver innovative machine solutions to tens of millions of users every month? Does the opportunity to join a,2020-01-29T00:47:43.964000,Washington,62.0,,,,783401,True,['external'],0.0,"Bellevue, Washington, United States",Engineering,
1713,13,United States,Software Engineering,,Senior Software Engineer (Frontend),"['Sunnyvale, California, United States']",,,Experienced professionals,en_us,"[{'location': 'Sunnyvale, California, United States'}]",784676,2020-01-29T02:11:00,,"What is Yammer?Yammer is THE social network for the workplace - used by millions of employees every day to build community and culture, share knowledge, and connect with their leaders and each other.",2020-01-29T02:40:35.711000,California,63.0,,,,784676,True,['external'],0.0,"Sunnyvale, California, United States",Engineering,
1722,22,United States,Software Engineering,,Senior Software Engineer,"['Redmond, Washington, United States']",,,Experienced professionals,en_us,"[{'location': 'Redmond, Washington, United States'}]",731826,2019-12-20T05:58:00,,Come work on an exciting language and compiler effort that is making C safer! The Azure Sphere team is looking for a Senior Compiler Engineer to work on the Checked C compiler. There is an urgent need,2020-01-27T17:14:33.535000,Washington,63.0,,,,731826,True,['external'],0.0,"Redmond, Washington, United States",Engineering,
1732,32,United States,Software Engineering,,Critical Environment Field Service Engineer,"['Reston, Virginia, United States']",,,Experienced professionals,en_us,"[{'location': 'Reston, Virginia, United States'}]",772297,2020-01-14T21:44:00,,"Microsoft&rsquo;s Cloud Operations &amp; Innovation (CO+I) is the engine that powers our cloud services. As a CO+I CE Field Services Engineer, you will perform a key role in delivering the core",2020-01-14T21:50:06.507000,Virginia,61.0,,,,772297,True,['external'],0.0,"Reston, Virginia, United States",Engineering,
1735,35,United States,Software Engineering,,Software Engineer,"['Redmond, Washington, United States']",,,Experienced professionals,en_us,"[{'location': 'Redmond, Washington, United States'}]",785445,2020-01-31T00:01:00,,"Are you a pioneer? Do you have an unwavering focus on delighting customers? Do you want to define the user experience for computing devices of the future? We are looking for talented, passionate and",2020-01-31T00:03:31.450000,Washington,60.0,,,,785445,True,['external'],0.0,"Redmond, Washington, United States",Engineering,
1736,36,United States,Software Engineering,,Senior Software Engineer,"['Bellevue, Washington, United States']",,,Experienced professionals,en_us,"[{'location': 'Bellevue, Washington, United States'}]",783699,2020-01-28T00:26:00,,The Dynamics 365 Retail for team delivers a holistic software-as-a-service offering to delight our customers in the multi-billion-dollar retail industry software market. Our offering spans across,2020-01-28T01:12:06.788000,Washington,64.0,,,,783699,True,['external'],0.0,"Bellevue, Washington, United States",Engineering,
1737,37,United States,Software Engineering,,Principal Software Engineer,"['Redmond, Washington, United States']",,,Experienced professionals,en_us,"[{'location': 'Redmond, Washington, United States'}]",771777,2020-01-10T16:44:00,,"Are you an expert at building world class, global scale services? Can you bring a growth mindset, a passion for diversity and inclusion, and a thirst to learn? Can you deliver high value, flexible",2020-01-10T16:45:37.931000,Washington,65.0,,,,771777,True,['external'],0.0,"Redmond, Washington, United States",Engineering,
1738,38,United States,Software Engineering,,Software Engineer II,"['Redmond, Washington, United States']",,,Experienced professionals,en_us,"[{'location': 'Redmond, Washington, United States'}]",735126,2020-01-30T19:58:00,,"Our mission is to build best-in-class developer productivity systems and services that dramatically improve the efficiency and effectiveness of thousands of engineers. As a member of this team, you",2020-01-30T20:03:32.612000,Washington,62.0,,,,735126,True,['external'],0.0,"Redmond, Washington, United States",Engineering,
1740,40,United States,Software Engineering,,Software Engineer 2,"['Redmond, Washington, United States']",,,Experienced professionals,en_us,"[{'location': 'Redmond, Washington, United States'}]",784255,2020-01-30T20:28:00,,"Microsoft Word is a household name and is the go-to tool for creating digital documents for hundreds of millions of users worldwide. For decades, the basis of this business has been client",2020-01-30T21:32:35.077000,Washington,61.0,,,,784255,True,['external'],0.0,"Redmond, Washington, United States",Engineering,
1743,43,United States,Software Engineering,,Software Engineer 2,"['Redmond, Washington, United States']",,,Experienced professionals,en_us,"[{'location': 'Redmond, Washington, United States'}]",785330,2020-01-30T21:39:00,,"We are building the platform for bringing machine learning and AI into Office applications, for assisting tens of millions of users every single day, across all major operating systems and form",2020-01-30T22:24:33.039000,Washington,62.0,,,,785330,True,['external'],0.0,"Redmond, Washington, United States",Engineering,
1745,45,United States,Software Engineering,,Software Engineer II,"['Redmond, Washington, United States']",,,Experienced professionals,en_us,"[{'location': 'Redmond, Washington, United States'}]",785869,2020-01-30T22:26:00,,"Do you want to help build the best customer experiences for graphical content across the PowerPoint, Word, and Excel web applications? Does the idea of establishing a center of excellence in our",2020-01-30T23:04:32.940000,Washington,62.0,,,,785869,True,['external'],0.0,"Redmond, Washington, United States",Engineering,
1747,47,United States,Hardware Development Engineering,,Senior Hardware Engineering PM,"['Redmond, Washington, United States']",,,Experienced professionals,en_us,"[{'location': 'Redmond, Washington, United States'}]",782617,2020-01-24T19:21:00,,We are seeking a candidate with hardware test experience who can work with Microsoft&rsquo;s internal teams as well as suppliers to develop and implement qualification plans and test cases for,2020-01-24T19:25:32.030000,Washington,64.0,,,,782617,True,['external'],0.0,"Redmond, Washington, United States",Hardware Engineering,
1748,48,United States,Software Engineering,,Senior Software Engineer,"['Redmond, Washington, United States']",,,Experienced professionals,en_us,"[{'location': 'Redmond, Washington, United States'}]",786224,2020-01-31T02:19:00,,"The IC3 Media Platform Teams is responsible for audio/video device access in calls made by the most important products in Realtime communication, including Teams and Skype, which account for millions",2020-01-31T03:09:35.098000,Washington,63.0,,,,786224,True,['external'],0.0,"Redmond, Washington, United States",Engineering,
1749,49,United States,Software Engineering,,Software Engineer,"['Redmond, Washington, United States']",,,Experienced professionals,en_us,"[{'location': 'Redmond, Washington, United States'}]",786274,2020-01-31T00:43:00,,"Microsoft 365 continues to lead the cloud transformation for Microsoft, with hundreds of thousands of customers and hundreds of millions of users already on the service. More than ever, our customers",2020-01-31T01:25:02.447000,Washington,60.0,,,,786274,True,['external'],0.0,"Redmond, Washington, United States",Engineering,
1754,4,United States,Software Engineering,,Software Engineer II,"['Redmond, Washington, United States']",,,Experienced professionals,en_us,"[{'location': 'Redmond, Washington, United States'}]",774544,2020-01-14T21:45:00,,"The Identity engineering team builds and manages Microsoft&rsquo;s online Identity platform for all of Microsoft&rsquo;s online services and enables Azure AD Identity integration with Azure, Office,",2020-01-14T21:50:05.013000,Washington,61.0,,,,774544,True,['external'],0.0,"Redmond, Washington, United States",Engineering,
1758,8,United States,Service Engineering,,Azure Cloud Engineer II,"['Redmond, Washington, United States']",,,Experienced professionals,en_us,"[{'location': 'Redmond, Washington, United States'}]",638818,2019-11-22T22:17:00,,Would you like to join one of the fastest-growing teams within Microsoft Azure Engineering? Are you customer-obsessed constantly looking for ways to improve customer experience? Are you passionate,2019-11-25T19:04:33.694000,Washington,61.0,,,,638818,True,['external'],0.0,"Redmond, Washington, United States",Engineering,
1766,16,United States,Software Engineering,,Software Engineer II,"['Redmond, Washington, United States']",,,Experienced professionals,en_us,"[{'location': 'Redmond, Washington, United States'}]",731091,2019-10-25T17:42:00,,The Core Services Engineering &amp; Operations (CSEO) group is leading the company&rsquo;s Digital Transformation journey. We see across the entire company for future business needs &ndash; building,2019-10-25T17:46:30.983000,Washington,62.0,,,,731091,True,['external'],0.0,"Redmond, Washington, United States",Engineering,
1768,18,United States,Software Engineering,,Senior Software Engineer,"['Redmond, Washington, United States']",,,Experienced professionals,en_us,"[{'location': 'Redmond, Washington, United States'}]",755259,2019-12-04T23:20:00,,The Core Services Engineering &amp; Operations (CSEO) group is leading the company&rsquo;s Digital Transformation journey. We see across the entire company for future business needs &ndash; building,2019-12-04T23:22:31.957000,Washington,64.0,,,,755259,True,['external'],0.0,"Redmond, Washington, United States",Engineering,
1769,19,United States,Electrical Engineering,,Senior Hardware Engineer,"['Redmond, Washington, United States']",,,Experienced professionals,en_us,"[{'location': 'Redmond, Washington, United States'}]",713610,2020-01-23T02:09:00,,Are you interested in helping deliver a product targeted at a multi-billion unit market? We're looking for engineers to join the Azure Sphere Silicon ACE team. Thousands of businesses are undergoing a,2020-01-23T02:11:31.801000,Washington,63.0,,,,713610,True,['external'],0.0,"Redmond, Washington, United States",Hardware Engineering,
1773,23,United States,Software Engineering,,Senior Software Engineer,"['Redmond, Washington, United States']",,,Experienced professionals,en_us,"[{'location': 'Redmond, Washington, United States'}]",719798,2019-10-08T20:32:00,,Are you interested in helping deliver a product targeted at a multi-billion-unit market? Thousands of businesses are undergoing a digital transformation to connect MCU based devices to the Internet. 9,2019-10-08T20:37:32.706000,Washington,63.0,,,,719798,True,['external'],0.0,"Redmond, Washington, United States",Engineering,
1774,24,United States,Software Engineering,,Senior Software Engineer,"['Redmond, Washington, United States']",,,Experienced professionals,en_us,"[{'location': 'Redmond, Washington, United States'}]",718875,2019-10-07T18:25:00,,"Microsoft 365 delivers human-centered experiences at a scale that is difficult to fathom.  From e-mail to People to Search to Intelligence and Analytics, we earn the trust of our customers and",2019-10-07T18:26:33.451000,Washington,63.0,,,,718875,True,['external'],0.0,"Redmond, Washington, United States",Engineering,
1776,26,United States,Software Engineering,,Software Engineer 2,"['Redmond, Washington, United States']",,,Experienced professionals,en_us,"[{'location': 'Redmond, Washington, United States'}]",773624,2020-01-13T23:01:00,,"Microsoft 365 continues to lead the cloud transformation for Microsoft, with hundreds of thousands of customers and hundreds of millions of users already on the service. More than ever, our customers",2020-01-13T23:05:43.094000,Washington,61.0,,,,773624,True,['external'],0.0,"Redmond, Washington, United States",Engineering,
1778,28,United States,Software Engineering,,Software Engineer II,"['Redmond, Washington, United States']",,,Experienced professionals,en_us,"[{'location': 'Redmond, Washington, United States'}]",779221,2020-01-22T21:49:00,,"Are you passionate about building a framework and runtime for great Web user experiences? Would you get excited about working in awesome Azure Portal team? If so, come join the Azure Portal",2020-01-22T21:54:21.379000,Washington,62.0,,,,779221,True,['external'],0.0,"Redmond, Washington, United States",Engineering,
1780,30,United States,Software Engineering,,Software Engineer II,"['Redmond, Washington, United States']",,,Experienced professionals,en_us,"[{'location': 'Redmond, Washington, United States'}]",777635,2020-01-23T07:30:00,,"Azure Performance Infrastructure Engineering goal is to make it easy for everyone to create, consume, and manage planetary-scale, reliable cloud production services and infrastructure to achieve more.",2020-01-23T07:35:40.866000,Washington,62.0,,,,777635,True,['external'],0.0,"Redmond, Washington, United States",Engineering,
1781,31,United States,Software Engineering,,Senior Software Engineer,"['Redmond, Washington, United States']",,,Experienced professionals,en_us,"[{'location': 'Redmond, Washington, United States'}]",745262,2019-11-18T21:23:00,,"The Identity engineering team builds and manages Microsoft&rsquo;s online identity providers for all of Microsoft&rsquo;s online services and platforms like Azure, Office, Xbox, and HoloLens. We",2019-11-18T21:33:05.718000,Washington,63.0,,,,745262,True,['external'],0.0,"Redmond, Washington, United States",Engineering,
1782,32,United States,Software Engineering,,Software Engineering Manager,"['Bellevue, Washington, United States']",,,Experienced professionals,en_us,"[{'location': 'Bellevue, Washington, United States'}]",779554,2020-01-23T19:42:00,,The Microsoft Whiteboard application was released in 2019 and is one of the fastest growing Office 365 applications. We have a Windows application that users love that is preinstalled on Surface,2020-01-23T19:48:04.576000,Washington,65.0,,,,779554,True,['external'],0.0,"Bellevue, Washington, United States",Engineering,
1784,34,United States,Service Engineering,,Azure Cloud Engineer,"['Atlanta, Georgia, United States']",,,Experienced professionals,en_us,"[{'location': 'Atlanta, Georgia, United States'}]",716243,2019-10-02T18:41:00,,Would you like to join one of the fastest-growing teams within Microsoft Azure Engineering? Are you customer-obsessed constantly looking for ways to improve customer experience? Are you passionate,2019-10-02T18:45:38.571000,Georgia,60.0,,,,716243,True,['external'],0.0,"Atlanta, Georgia, United States",Engineering,
1785,35,United States,Service Engineering,,Azure Cloud Engineer II,"['Atlanta, Georgia, United States']",,,Experienced professionals,en_us,"[{'location': 'Atlanta, Georgia, United States'}]",740562,2019-11-14T15:47:00,,Would you like to join one of the fastest-growing teams within Microsoft Azure Engineering? Are you customer-obsessed constantly looking for ways to improve customer experience? Are you passionate,2019-11-14T15:53:41.263000,Georgia,62.0,,,,740562,True,['external'],0.0,"Atlanta, Georgia, United States",Engineering,
1786,36,United States,Service Engineering,,Azure Cloud Engineer II,"['Atlanta, Georgia, United States']",,,Experienced professionals,en_us,"[{'location': 'Atlanta, Georgia, United States'}]",740216,2019-11-07T17:44:00,,Would you like to join one of the fastest-growing teams within Microsoft Azure Engineering? Are you customer-obsessed constantly looking for ways to improve customer experience? Are you passionate,2019-11-07T17:49:33.357000,Georgia,61.0,,,,740216,True,['external'],0.0,"Atlanta, Georgia, United States",Engineering,
1789,39,United States,Hardware Engineering Program Management,,Hardware Engineering Program Manager 2,"['Redmond, Washington, United States']",,,Experienced professionals,en_us,"[{'location': 'Redmond, Washington, United States'}]",782317,2020-01-23T23:55:00,,The Xbox Console development team is seeking a qualified candidate for a Program Manager to drive and manage the development and enhancements to the Xbox Console and its related subsystems. This,2020-01-23T23:57:34.040000,Washington,63.0,,,,782317,True,['external'],0.0,"Redmond, Washington, United States",Hardware Engineering,
1791,41,United States,Service Engineering,,Senior Service Reliability Engineer - CTJ,"['Reston, Virginia, United States']",,,Experienced professionals,en_us,"[{'location': 'Reston, Virginia, United States'}]",750766,2020-01-15T14:07:00,,Do you want to be at the heart of cloud computing? Azure Compute is the core of our cloud platform and is growing incredibly fast. We build fault tolerant distributed systems on top of commodity,2020-01-23T17:22:42.380000,Virginia,63.0,,,,750766,True,['external'],0.0,"Reston, Virginia, United States",Engineering,
1795,45,United States,Software Engineering,,Principal Software Engineer,"['Redmond, Washington, United States']",,,Experienced professionals,en_us,"[{'location': 'Redmond, Washington, United States'}]",714995,2020-01-23T23:35:00,,Are you interested in helping deliver a product targeted at a multi-billion unit market? Thousands of businesses are undergoing a digital transformation to connect MCU based devices to the internet. 9,2020-01-29T17:35:54.899000,Washington,65.0,,,,714995,True,['external'],0.0,"Redmond, Washington, United States",Engineering,
1796,46,United States,Software Engineering,,Principal Software Engineer Lead,"['Redmond, Washington, United States']",,,Experienced professionals,en_us,"[{'location': 'Redmond, Washington, United States'}]",707430,2020-01-23T23:33:00,,Are you interested in helping deliver a product targeted at a multi-billion unit market? Thousands of businesses are undergoing a digital transformation to connect MCU based devices to the internet. 9,2020-01-29T17:35:55.881000,Washington,65.0,,,,707430,True,['external'],0.0,"Redmond, Washington, United States",Engineering,
1798,48,United States,Software Engineering,,Senior Software Engineer,"['Redmond, Washington, United States']",,,Experienced professionals,en_us,"[{'location': 'Redmond, Washington, United States'}]",784571,2020-01-29T17:51:00,,"Do large-scale, self-healing services excite you? Do you love working on a highly-collaborative team? If so, we'd like to hear from you! We own a critical backend execution engine for the Microsoft",2020-01-29T18:30:15.753000,Washington,63.0,,,,784571,True,['external'],0.0,"Redmond, Washington, United States",Engineering,
1799,49,United States,Software Engineering,,Senior Software Engineer,"['Redmond, Washington, United States']",,,Experienced professionals,en_us,"[{'location': 'Redmond, Washington, United States'}]",784463,2020-01-29T17:53:00,,"Office 365 is the locomotive that is driving the growing Microsoft valuation, and critical to the future of the company. Substrate is the set of intelligent, high value services and compliant",2020-01-29T17:57:31.103000,Washington,64.0,,,,784463,True,['external'],0.0,"Redmond, Washington, United States",Engineering,
1803,3,United States,Software Engineering,,Hardware Design Engineer,"['Redmond, Washington, United States']",,,Experienced professionals,en_us,"[{'location': 'Redmond, Washington, United States'}]",796759,2020-02-19T22:07:00,,"Microsoft is a leader in the design of world class entertainment devices. We are looking for energetic, creative design engineers to work in the dynamic Microsoft Silicon team, working on custom and",2020-02-19T22:12:33.725000,Washington,63.0,,,,796759,True,['external'],0.0,"Redmond, Washington, United States",Engineering,
1806,6,United States,Mechanical Engineering,,Mechanical Engineer for Optical Systems Development,"['Redmond, Washington, United States']",,,Experienced professionals,en_us,"[{'location': 'Redmond, Washington, United States'}]",791538,2020-02-20T22:05:00,,"Overview: Datacenter Advanced Development leads technology innovation for CO+I and is based in Redmond, Washington. We are seeking passionate and driven Mechanical engineer to lead innovation programs",2020-02-20T22:10:37.744000,Washington,65.0,,,,791538,True,['external'],0.0,"Redmond, Washington, United States",Hardware Engineering,
1814,14,United States,Software Engineering,,Principal Software Engineer,"['Redmond, Washington, United States']",,,Experienced professionals,en_us,"[{'location': 'Redmond, Washington, United States'}]",798419,2020-02-21T17:20:00,,Would you like to work on a product that will directly impact the daily life of billions of people? Or would you like to work on a product that is used by over 90% of the largest fortune 100,2020-02-21T17:24:39.560000,Washington,65.0,,,,798419,True,['external'],0.0,"Redmond, Washington, United States",Engineering,
1815,15,United States,Support Engineering,,Embedded Escalation Engineer - Azure App Service,"['Redmond, Washington, United States', 'Las Colinas, Texas, United States']",,,Experienced professionals,en_us,"[{'location': 'Redmond, Washington, United States'}, {'location': 'Las Colinas, Texas, United States'}]",797603,2020-02-21T17:26:00,,Interested in being on the cutting edge of Cloud Services? Love services support in the Cloud? Customer obsessed? Data Driven? Collaborator? Communicator? Troubleshooter? Debugger? Then come join,2020-02-21T17:30:57.581000,Washington,62.0,,,,797603,True,['external'],0.0,"Redmond, Washington, United States",Services,
1817,17,United States,Software Engineering,,"Senior Software Engineer, Multiplayer Gameplay","['Redmond, Washington, United States']",,,Experienced professionals,en_us,"[{'location': 'Redmond, Washington, United States'}]",612576,2019-07-29T19:44:00,,"343 Industries, the studio developing titles in the Halo universe, is looking for a talented gameplay engineer to join our multiplayer team working on the next installment in our franchise&hellip;",2019-07-29T19:57:34.505000,Washington,63.0,,,,612576,True,['external'],0.0,"Redmond, Washington, United States",Engineering,
1820,20,United States,Software Engineering,,Support Escalation Engineer-HPC,"['Charlotte, North Carolina, United States', 'Las Colinas, Texas, United States', 'Redmond, Washington, United States']",,,Experienced professionals,en_us,"[{'location': 'Charlotte, North Carolina, United States'}, {'location': 'Las Colinas, Texas, United States'}, {'location': 'Redmond, Washington, United States'}]",792714,2020-02-21T18:14:00,,"No two days are the same in Customer Service and Support at Microsoft. We solve challenging and complex problems every day, we collaborate and share knowledge with each other and innovate solutions",2020-02-21T18:15:34.781000,North Carolina,61.0,,,,792714,True,['external'],0.0,"Charlotte, North Carolina, United States",Engineering,
1822,22,United States,Software Engineering,,Senior Software Engineer,"['Redmond, Washington, United States']",,,Experienced professionals,en_us,"[{'location': 'Redmond, Washington, United States'}]",797996,2020-02-21T21:18:00,,"Office 365 is one the fastest growing businesses in Microsoft. You can be part of our Global Customer Promises team is to drive compliance with Enterprise promises and Antitrust obligations, to",2020-02-21T21:20:32.026000,Washington,63.0,,,,797996,True,['external'],0.0,"Redmond, Washington, United States",Engineering,
1823,23,United States,Software Engineering,,Software Engineer 2 - Azure Compute,"['Atlanta, Georgia, United States']",,,Experienced professionals,en_us,"[{'location': 'Atlanta, Georgia, United States'}]",797503,2020-02-21T22:07:00,,Do you want to be at the very heart of Microsoft&rsquo;s Intelligent Cloud and help solve interesting problems? Azure Compute is at the core of Azure's Cloud Computing platform with phenomenal,2020-02-21T22:08:33.282000,Georgia,62.0,,,,797503,True,['external'],0.0,"Atlanta, Georgia, United States",Engineering,
