,Unnamed: 0,country,subCategory,industry,title,multi_location,type,orgFunction,experience,locale,multi_location_array,jobSeqNo,postedDate,searchresults_display,descriptionTeaser,dateCreated,state,targetLevel,jd_display,reqId,badge,jobId,isMultiLocation,jobVisibility,mostpopular,location,category,locationLatlong
2405,5,United States,Software Engineering,,Software Engineer 2,"['Redmond, Washington, United States']",,,Experienced professionals,en_us,"[{'location': 'Redmond, Washington, United States'}]",799719,2020-02-27T22:46:00,,"The Fabric and Mobile team is building the next version of OneNote mobile working on a variety of services and machine learning models to unify quick note taking and recall across the Microsoft Graph,",2020-02-27T22:48:40.199000,Washington,61.0,,,,799719,True,['external'],0.0,"Redmond, Washington, United States",Engineering,
2407,7,United States,Software Engineering,,Senior Software Engineer,"['Redmond, Washington, United States']",,,Experienced professionals,en_us,"[{'location': 'Redmond, Washington, United States'}]",799715,2020-02-27T22:36:00,,"The Fabric and Mobile team is building the next version of OneNote mobile working on a variety of services and machine learning models to unify quick note taking and recall across the Microsoft Graph,",2020-02-27T22:38:32.531000,Washington,63.0,,,,799715,True,['external'],0.0,"Redmond, Washington, United States",Engineering,
2408,8,United States,Mechanical Engineering,,Principal Mechanical Engineer,"['Redmond, Washington, United States']",,,Experienced professionals,en_us,"[{'location': 'Redmond, Washington, United States'}]",795645,2020-02-23T06:55:00,,Are you looking to join a fast paced team to deliver the next generation of industry leading wireless products? Microsoft&rsquo;s Surface Team is looking for a talented individual to jAre you looking,2020-02-27T22:25:33.414000,Washington,65.0,,,,795645,True,['external'],0.0,"Redmond, Washington, United States",Hardware Engineering,
2411,11,United States,Support Engineering,,Support Engineer,"['Fargo, North Dakota, United States', 'Las Colinas, Texas, United States']",,,Experienced professionals,en_us,"[{'location': 'Fargo, North Dakota, United States'}, {'location': 'Las Colinas, Texas, United States'}]",755276,2020-01-09T13:05:00,,Customer Service &amp; Support&middot; Do you want to empower every person and every organization on the planet to achieve more? &middot; Do you want to work in an open and inclusive environment where,2020-01-09T13:07:33.389000,North Dakota,61.0,,,,755276,True,['external'],0.0,"Fargo, North Dakota, United States",Services,
2412,12,United States,Software Engineering,,Senior Software Engineer,"['Redmond, Washington, United States']",,,Experienced professionals,en_us,"[{'location': 'Redmond, Washington, United States'}]",786838,2020-02-05T23:14:00,,"BigData is just starting to change the world, and the BigData team at C&amp;E has one of the biggest cluster deployments in the world, running over hundreds of thousands of machines in multiple",2020-02-07T04:10:34.716000,Washington,64.0,,,,786838,True,['external'],0.0,"Redmond, Washington, United States",Engineering,
2413,13,United States,Software Engineering,,Software Engineer,"['Redmond, Washington, United States']",,,Experienced professionals,en_us,"[{'location': 'Redmond, Washington, United States'}]",801616,2020-02-28T01:26:00,,"Are you passionate about building world class, always available, scalable, highly responsive services? Do you want to work on building enterprise scale services with focus on customer experiences,",2020-02-28T01:28:32.348000,Washington,61.0,,,,801616,True,['external'],0.0,"Redmond, Washington, United States",Engineering,
2414,14,United States,Electrical Engineering,,Product Engineer,"['Sunnyvale, California, United States']",,,Experienced professionals,en_us,"[{'location': 'Sunnyvale, California, United States'}]",801513,2020-02-28T01:29:00,,"Microsoft HoloLens Team is continuing to revolutionize consumer electronic devices. We are currently looking for a Product Engineer, The position requires experience in the Fabless semiconductor model",2020-02-28T01:31:42.009000,California,64.0,,,,801513,True,['external'],0.0,"Sunnyvale, California, United States",Hardware Engineering,
2421,21,United States,Software Engineering,,Principal Software Engineer,"['Redmond, Washington, United States']",,,Experienced professionals,en_us,"[{'location': 'Redmond, Washington, United States'}]",801430,2020-02-27T22:21:00,,Azure Database for PostgreSQL is the newest service added to the family of relational database services provided in Microsoft Azure. We are expanding the choice of database services in Azure and need,2020-02-27T22:24:34.690000,Washington,65.0,,,,801430,True,['external'],0.0,"Redmond, Washington, United States",Engineering,
2422,22,United States,Software Development,,Software Engineer II,"['Redmond, Washington, United States']",,,Experienced professionals,en_us,"[{'location': 'Redmond, Washington, United States'}]",789781,2020-02-07T20:27:00,,"If you are passionate about building large-scale data processing systems, solving hard problems, creating platform solutions used by thousands of developers - we would love to talk to you. Azure",2020-02-07T21:24:54.510000,Washington,62.0,,,,789781,True,['external'],0.0,"Redmond, Washington, United States",Engineering,
2426,26,United States,Software Engineering,,Software Engineer II,"['Redmond, Washington, United States']",,,Experienced professionals,en_us,"[{'location': 'Redmond, Washington, United States'}]",797938,2020-02-28T03:13:00,,The Mobile Connectivity team is looking for a software engineer to drive work across Microsoft to ship new wireless platforms and experiences for the intelligent Edge utilizing the latest wireless,2020-02-28T03:15:35.280000,Washington,62.0,,,,797938,True,['external'],0.0,"Redmond, Washington, United States",Engineering,
2427,27,United States,Software Engineering,,Senior Software Engineer (iOS Development),"['Sunnyvale, California, United States']",,,Experienced professionals,en_us,"[{'location': 'Sunnyvale, California, United States'}]",801717,2020-02-28T04:30:00,,"Microsoft Teams is the fastest growing business application and already has more than twenty million monthly users. It is a critical part of Office 365, the premier productivity suite from Microsoft.",2020-02-28T04:36:31.908000,California,63.0,,,,801717,True,['external'],0.0,"Sunnyvale, California, United States",Engineering,
2432,32,United States,Software Engineering,,Software Engineer II,"['Redmond, Washington, United States']",,,Experienced professionals,en_us,"[{'location': 'Redmond, Washington, United States'}]",MIC72754,2020-02-28T05:30:00,,"Responsible for developing or testing computer SW applications, systems or services. Evaluate requirements, estimate development costs, design and implement the SW and more.",2020-02-28T11:50:31.227000,Washington,,,,,MIC72754,True,['external'],0.0,"Redmond, Washington, United States",Engineering,
2433,33,United States,Software Engineering,,Senior Software Engineer,"['Redmond, Washington, United States']",,,Experienced professionals,en_us,"[{'location': 'Redmond, Washington, United States'}]",798696,2020-02-25T21:21:00,,"Do you love the engineering challenges of designing and delivering cutting-edge, cloud-scale distributed systems technologies? Do you want to enable cloud-based, stately applications that are",2020-02-25T21:25:32.152000,Washington,63.0,,,,798696,True,['external'],0.0,"Redmond, Washington, United States",Engineering,
2438,38,United States,Software Engineering,,Software Engineer II – Xbox Live Multiplayer,"['Redmond, Washington, United States']",,,Experienced professionals,en_us,"[{'location': 'Redmond, Washington, United States'}]",786301,2020-02-05T23:15:00,,"Do you have a passion for gaming? Are you a software developer passionate about building highly scalable gaming services? The Xbox Live team designs, develops, and maintains services that directly",2020-02-05T23:16:30.877000,Washington,61.0,,,,786301,True,['external'],0.0,"Redmond, Washington, United States",Engineering,
2440,40,United States,Support Engineering,,Support Escalation Engineer - (Windows) Active Directory Services,"['Charlotte, North Carolina, United States', 'Las Colinas, Texas, United States']",,,Experienced professionals,en_us,"[{'location': 'Charlotte, North Carolina, United States'}, {'location': 'Las Colinas, Texas, United States'}]",748959,2019-11-26T15:50:00,,"Overview:No two days are the same in Customer Service and Support at Microsoft. We engage in solving challenging and complex problems, we collaborate and share learnings with each other and innovate",2019-11-26T15:53:34.144000,North Carolina,62.0,,,,748959,True,['external'],0.0,"Charlotte, North Carolina, United States",Services,
2441,41,United States,Software Engineering,,Prinicipal Software Engineering Manager,"['Redmond, Washington, United States']",,,Experienced professionals,en_us,"[{'location': 'Redmond, Washington, United States'}]",800894,2020-02-28T18:57:00,,"With Azure Sentinel, Microsoft is redefining SIEM (Security Information and Event Management) for the cloud era. It leverages cutting-edge cloud technology, big data, machine learning and AI to",2020-02-28T19:02:33.679000,Washington,65.0,,,,800894,True,['external'],0.0,"Redmond, Washington, United States",Engineering,
2442,42,United States,Software Engineering,,Senior Software Engineer,"['Redmond, Washington, United States']",,,Experienced professionals,en_us,"[{'location': 'Redmond, Washington, United States'}]",788294,2020-02-27T07:15:00,,Are you interested in joining a start up within Microsoft where you'll have the rare opportunity to create the future of IT management and help drive the company's modern workplace initiative?,2020-02-28T19:17:31.912000,Washington,63.0,,,,788294,True,['external'],0.0,"Redmond, Washington, United States",Engineering,
2451,1,United States,Electrical Engineering,,Senior Display Engineer,"['Redmond, Washington, United States']",,,Experienced professionals,en_us,"[{'location': 'Redmond, Washington, United States'}]",788018,2020-02-06T22:18:00,,Are you passionate about building cool devices and technologies? The Surface Team focuses on lighting up Microsoft experiences with touch first computing. A fundamental part of our strategy is having,2020-02-06T22:24:38.020000,Washington,63.0,,,,788018,True,['external'],0.0,"Redmond, Washington, United States",Hardware Engineering,
2453,3,United States,Software Engineering,,Principal Engineering Manager,"['Redmond, Washington, United States']",,,Experienced professionals,en_us,"[{'location': 'Redmond, Washington, United States'}]",763753,2019-12-20T04:41:00,, Are you interested in joining a startup within Microsoft where you'll have the rare opportunity to create the future of IT management and help drive the company's Modern Workplace initiative?,2019-12-20T05:28:48.959000,Washington,66.0,,,,763753,True,['external'],0.0,"Redmond, Washington, United States",Engineering,
2455,5,United States,Software Engineering,,Software Engineer,"['Redmond, Washington, United States']",,,Experienced professionals,en_us,"[{'location': 'Redmond, Washington, United States'}]",786142,2020-02-07T00:37:00,,"Do you dream of building low latency, highly available, large scale, cloud based real-time communication services used by millions of customers in both business and consumer world? Do you want to be",2020-02-07T00:39:33.001000,Washington,60.0,,,,786142,True,['external'],0.0,"Redmond, Washington, United States",Engineering,
2456,6,United States,Software Engineering,,Software Engineer II,"['Redmond, Washington, United States']",,,Experienced professionals,en_us,"[{'location': 'Redmond, Washington, United States'}]",740506,2020-02-07T00:19:00,,"Microsoft 365 is the world&rsquo;s leading productivity service, entrusted by hundreds of millions of users and customers worldwide, and Microsoft 365 Core is at the center of it. We are building",2020-02-07T00:39:33.678000,Washington,62.0,,,,740506,True,['external'],0.0,"Redmond, Washington, United States",Engineering,
2458,8,United States,Software Engineering,,Sr Software Engineer,"['Redmond, Washington, United States']",,,Experienced professionals,en_us,"[{'location': 'Redmond, Washington, United States'}]",601654,2019-07-25T16:08:00,,Do you want to participate in creating and delivering the next generation of technologies to automate private and public cloud infrastructures? Do you love to contribute to open source technologies,2019-07-25T16:10:34.202000,Washington,63.0,,,,601654,True,['external'],0.0,"Redmond, Washington, United States",Engineering,
2459,9,United States,Service Engineering,,Service Engineer,"['Redmond, Washington, United States']",,,Experienced professionals,en_us,"[{'location': 'Redmond, Washington, United States'}]",733346,2019-10-28T23:04:00,,"Microsoft Managed Desktop (MMD) is an important, new offering where Microsoft take a more significant role in the deployment and management of the corporate desktop computing platforms, leveraging our",2019-10-28T23:06:33.260000,Washington,62.0,,,,733346,True,['external'],0.0,"Redmond, Washington, United States",Engineering,
2460,10,United States,Software Engineering,,Senior Software Engineer,"['Redmond, Washington, United States']",,,Experienced professionals,en_us,"[{'location': 'Redmond, Washington, United States'}]",784643,2020-02-03T18:33:00,," Microsoft Azure Storage is a highly distributed, massively scalable, and ubiquitously accessible cloud storage system designed to scale out and serve the entire world. Azure storage already runs at",2020-02-03T18:42:36.917000,Washington,63.0,,,,784643,True,['external'],0.0,"Redmond, Washington, United States",Engineering,
2461,11,United States,Software Engineering,,Principal Software Engineering Manager,"['Redmond, Washington, United States']",,,Experienced professionals,en_us,"[{'location': 'Redmond, Washington, United States'}]",786325,2020-02-03T20:11:00,,Any Developer. Any App. Any Platform. Microsoft continues to make big investments to empower every person and every organization on the planet to achieve more. We care deeply about developers and,2020-02-03T20:15:50.789000,Washington,65.0,,,,786325,True,['external'],0.0,"Redmond, Washington, United States",Engineering,
2464,14,United States,Software Engineering,,Principal Software Engineering Manager,"['Redmond, Washington, United States']",,,Experienced professionals,en_us,"[{'location': 'Redmond, Washington, United States'}]",786742,2020-02-03T18:04:00,,"The Azure Redis Cache team provides customers with secure, dedicated Redis cache endpoints, exposed as a service, managed by Microsoft Azure. The service has seen very rapid growth since its",2020-02-03T18:06:33.228000,Washington,66.0,,,,786742,True,['external'],0.0,"Redmond, Washington, United States",Engineering,
2467,17,United States,Software Engineering,,Software Engineer II,"['Redmond, Washington, United States']",,,Experienced professionals,en_us,"[{'location': 'Redmond, Washington, United States'}]",786404,2020-02-03T21:42:00,,"The Crypto, Identity and Authentication Data Intelligence team is accountable for leveraging data and producing insights on the health, performance and happiness of customers using all forms of",2020-02-03T21:44:39.809000,Washington,61.0,,,,786404,True,['external'],0.0,"Redmond, Washington, United States",Engineering,
2468,18,United States,Software Engineering,,Senior Software Engineer,"['Redmond, Washington, United States']",,,Experienced professionals,en_us,"[{'location': 'Redmond, Washington, United States'}]",791146,2020-02-07T23:36:00,,Every once in a while a job comes along with an opportunity to be at forefront of a brand new business. If you have been waiting for that kind of opportunity this may be the job for you. We are a,2020-02-07T23:40:20.672000,Washington,64.0,,,,791146,True,['external'],0.0,"Redmond, Washington, United States",Engineering,
2469,19,United States,Software Engineering,,Software Engineer II,"['Redmond, Washington, United States']",,,Experienced professionals,en_us,"[{'location': 'Redmond, Washington, United States'}]",790676,2020-02-07T22:46:00,," Be part of the Mobile First, Cloud First excitement! The Microsoft Intune team delivers mobile device management, mobile application management and desktop computer management solutions from the",2020-02-07T23:40:37.951000,Washington,62.0,,,,790676,True,['external'],0.0,"Redmond, Washington, United States",Engineering,
2470,20,United States,Software Engineering,,Software Engineer 2,"['Redmond, Washington, United States']",,,Experienced professionals,en_us,"[{'location': 'Redmond, Washington, United States'}]",785496,2020-02-07T22:57:00,,"Are you looking to add cloud and mobile onto your resume? Are you excited to be a leader in the frontier to the world of software as service, especially for the highly profitable and high growth",2020-02-07T23:42:46.283000,Washington,61.0,,,,785496,True,['external'],0.0,"Redmond, Washington, United States",Engineering,
2471,21,United States,Software Engineering,,Software Engineer II,"['Redmond, Washington, United States']",,,Experienced professionals,en_us,"[{'location': 'Redmond, Washington, United States'}]",791081,2020-02-07T22:54:00,,Does pioneering new and innovative ways to collect and showcase key customer data sound exciting to you? Are you passionate about data and do you feel we&rsquo;ve been missing the opportunity to be,2020-02-07T23:42:38.018000,Washington,61.0,,,,791081,True,['external'],0.0,"Redmond, Washington, United States",Engineering,
2473,23,United States,Electrical Engineering,,Senior Electrical Engineer,"['Sunnyvale, California, United States']",,,Experienced professionals,en_us,"[{'location': 'Sunnyvale, California, United States'}]",788976,2020-02-07T23:22:00,,Are you passionate about building cool devices and technologies? The Surface Team focuses on lighting up Microsoft experiences with touch first computing. A fundamental part of our strategy is having,2020-02-08T00:19:15.353000,California,63.0,,,,788976,True,['external'],0.0,"Sunnyvale, California, United States",Hardware Engineering,
2474,24,United States,Mechanical Engineering,,Senior Mechanical Engineer,"['Redmond, Washington, United States']",,,Experienced professionals,en_us,"[{'location': 'Redmond, Washington, United States'}]",788979,2020-02-07T23:25:00,,Are you looking to join a fast-paced team to deliver the next generation of industry leading wireless products? Microsoft&rsquo;s Surface Team is looking for a talented individual to join our team to,2020-02-08T00:20:07.531000,Washington,63.0,,,,788979,True,['external'],0.0,"Redmond, Washington, United States",Hardware Engineering,
2476,26,United States,Software Engineering,,Senior Software Engineer,"['Bellevue, Washington, United States']",,,Experienced professionals,en_us,"[{'location': 'Bellevue, Washington, United States'}]",660519,2019-12-04T20:46:00,,"Microsoft Teams is the fastest growing Enterprise communication system. It is the hub for Office 365 products. Our culture is inclusive, casual and high energy; our team members come from diverse",2020-01-27T18:19:03.605000,Washington,63.0,,,,660519,True,['external'],0.0,"Bellevue, Washington, United States",Engineering,
2477,27,United States,Software Engineering,,Software Engineer 2,"['Bellevue, Washington, United States']",,,Experienced professionals,en_us,"[{'location': 'Bellevue, Washington, United States'}]",758996,2019-12-10T23:05:00,,"Azure Search is a globally distributed, fully managed, cloud-based search-as-a-service (SaaS) solution. As the hosted search engine on Azure, we make it quick and easy for developers to integrate a",2019-12-10T23:22:40.592000,Washington,61.0,,,,758996,True,['external'],0.0,"Bellevue, Washington, United States",Engineering,
2478,28,United States,Software Engineering,,Senior Software Engineer,"['Redmond, Washington, United States']",,,Experienced professionals,en_us,"[{'location': 'Redmond, Washington, United States'}]",790582,2020-02-08T01:19:00,,Microsoft's Cloud and AI division is looking for a Senior Software Engineer to work with us on the next generation of developer services and tools. Software developers are the productivity workforce,2020-02-08T02:19:01.622000,Washington,63.0,,,,790582,True,['external'],0.0,"Redmond, Washington, United States",Engineering,
2479,29,United States,Software Engineering,,Senior Software Engineer,"['Redmond, Washington, United States']",,,Experienced professionals,en_us,"[{'location': 'Redmond, Washington, United States'}]",773094,2020-02-08T03:14:00,,"Come join the team responsible for delivering the Visual Studio Marketplace, part of the Visual Studio family of products. In a 2019 survey done by stackoverflow.com, Visual Studio &amp; Visual Studio",2020-02-08T03:38:32.333000,Washington,64.0,,,,773094,True,['external'],0.0,"Redmond, Washington, United States",Engineering,
2480,30,United States,Software Development,,Platform Engineering Manager,"['Redmond, Washington, United States']",,,Experienced professionals,en_us,"[{'location': 'Redmond, Washington, United States'}]",685450,2020-01-24T16:43:00,,"At IC3 (Intelligent Conversation and Communications Cloud), our vision is to re-humanize communications &ldquo;from the living room to the boardroom.&rdquo; Skype is one of the de-facto communication",2020-02-08T18:36:32.849000,Washington,65.0,,,,685450,True,['external'],0.0,"Redmond, Washington, United States",Engineering,
2485,35,United States,Support Engineering,,Support Engineer,"['Las Colinas, Texas, United States', 'Fargo, North Dakota, United States']",,,Experienced professionals,en_us,"[{'location': 'Las Colinas, Texas, United States'}, {'location': 'Fargo, North Dakota, United States'}]",784023,2020-02-07T13:53:00,,"At Microsoft CSS (Customer Service and Support), the sentence: &ldquo;That&rsquo;s not our problem&rdquo; does not exist in our lexicon. We deliver world-class assistance around the clock to",2020-02-07T17:01:46.904000,Texas,60.0,,,,784023,True,['external'],0.0,"Las Colinas, Texas, United States",Services,
2486,36,United States,Hardware Development Engineering,,Hardware Engineer 2,"['Redmond, Washington, United States']",,,Experienced professionals,en_us,"[{'location': 'Redmond, Washington, United States'}]",782318,2020-02-07T03:09:00,," The AI and Advanced Architectures team innovates using a mix of algorithmic innovation, custom hardware, and framework-level software that interfaces to the hardware. We're looking for a motivated",2020-02-07T21:55:02.826000,Washington,62.0,,,,782318,True,['external'],0.0,"Redmond, Washington, United States",Hardware Engineering,
2488,38,United States,Software Engineering,,Sr. Software Engineer,"['Redmond, Washington, United States']",,,Experienced professionals,en_us,"[{'location': 'Redmond, Washington, United States'}]",792386,2020-02-12T22:31:00,,Are you interested in building global services for gamers and content creators to stream video to millions of viewers? Are you passionate about creating unique and excellent live streaming experiences,2020-02-12T23:16:37.917000,Washington,63.0,,,,792386,True,['external'],0.0,"Redmond, Washington, United States",Engineering,
2489,39,United States,Software Development,,Software Engineer 2,"['Bellevue, Washington, United States']",,,Experienced professionals,en_us,"[{'location': 'Bellevue, Washington, United States'}]",784510,2020-02-03T08:11:00,,The Microsoft Search Assistant and Intelligence team is responsible for delivering assistant and search capabilities across multiple Microsoft 365 applications. Part of our responsibilities include,2020-02-03T08:14:01.502000,Washington,62.0,,,,784510,True,['external'],0.0,"Bellevue, Washington, United States",Engineering,
2491,41,United States,Software Engineering,,Senior Software Engineer,"['Redmond, Washington, United States']",,,Experienced professionals,en_us,"[{'location': 'Redmond, Washington, United States'}]",730340,2019-10-30T22:45:00,,"At Microsoft, we strongly believe that Mixed Reality is the future. We are the Mixed Reality Services team, responsible for a suite of services including Remote Rendering and Azure Spatial Anchors,",2019-10-30T22:57:31.969000,Washington,64.0,,,,730340,True,['external'],0.0,"Redmond, Washington, United States",Engineering,
2492,42,United States,Software Engineering,,Software Engineer II,"['Redmond, Washington, United States']",,,Experienced professionals,en_us,"[{'location': 'Redmond, Washington, United States'}]",793131,2020-02-13T00:32:00,,Microsoft Dynamics 365 is a rapidly growing business at Microsoft and is considered one of the leaders in Software as a Service in the world of business applications. Dynamics 365 provides the best,2020-02-13T01:30:13.042000,Washington,61.0,,,,793131,True,['external'],0.0,"Redmond, Washington, United States",Engineering,
2493,43,United States,Software Engineering,,Senior Software Engineer,"['Redmond, Washington, United States']",,,Experienced professionals,en_us,"[{'location': 'Redmond, Washington, United States'}]",758278,2020-02-06T19:59:00,,"In Cognition, people&mdash;not devices&mdash;are at the center of everything we do. Our tech moves beyond screens and pixels, creating a new reality aimed at bringing us closer together&mdash;whether",2020-02-06T20:07:36.828000,Washington,63.0,,,,758278,True,['external'],0.0,"Redmond, Washington, United States",Engineering,
